{
  "schema": "PREDICTION_RESULT_RECEIPT_V1",
  "receipt_id": "RESULT-RECEIPT-cont-1791294904645-138e6385",
  "event_id": "cont-1791294904645-138e6385",
  "source_task_id": "CONT-WAKE-00fc50db9508f736fd6c67a5-A01",
  "created_at_utc": "2026-10-06T13:55:20Z",
  "live_trading": false,
  "paid_actions": false,
  "wallet_actions": false,
  "issuer": {
    "model": "GPT-5.6 Sol",
    "reasoning_level": "UNAVAILABLE_TO_RUNTIME"
  }
}
