{
  "schema": "PREDICTION_RESULT_RECEIPT_V1",
  "receipt_id": "RESULT-RECEIPT-cont-1791444902291-68c8ff1e",
  "event_id": "cont-1791444902291-68c8ff1e",
  "source_task_id": "CONT-WAKE-a06de98555a9d363f78163e8-A01",
  "created_at_utc": "2026-10-08T08:14:00Z",
  "live_trading": false,
  "paid_actions": false,
  "wallet_actions": false,
  "issuer": {
    "model": "GPT-5.6 Sol",
    "reasoning_level": "High"
  }
}
