{
  "schema": "PREDICTION_RESULT_RECEIPT_V1",
  "receipt_id": "RESULT-RECEIPT-1791186497-904a6d6cebec",
  "event_id": "1791186497-904a6d6cebec",
  "source_task_id": "DEV-PRED-RO-AUDIT-20261005-E005",
  "created_at_utc": "2026-10-05T07:50:23.416Z",
  "live_trading": false,
  "paid_actions": false,
  "wallet_actions": false,
  "issuer": {
    "model": "Codex; exact model identity unavailable to runtime",
    "reasoning_level": "UNAVAILABLE_TO_RUNTIME"
  }
}
