{
  "schema": "PREDICTION_RESULT_RECEIPT_V1",
  "receipt_id": "RESULT-RECEIPT-cont-1791401982870-b8c9f675",
  "event_id": "cont-1791401982870-b8c9f675",
  "source_task_id": "CONT-WAKE-ba6dfd4ce00e2fbe75181b8e-A01",
  "created_at_utc": "2026-10-07T21:55:30Z",
  "live_trading": false,
  "paid_actions": false,
  "wallet_actions": false,
  "issuer": {
    "model": "GPT-5.6 Sol",
    "reasoning_level": "High"
  }
}
