{
  "schema": "PREDICTION_RESULT_RECEIPT_V1",
  "receipt_id": "RESULT-RECEIPT-1791194971-a1ec57d7169a",
  "event_id": "1791194971-a1ec57d7169a",
  "source_task_id": "DEV-PRED-CANDIDATE-INVENTORY-COMPACT-20261005-E004",
  "created_at_utc": "2026-10-05T10:09:45.070Z",
  "live_trading": false,
  "paid_actions": false,
  "wallet_actions": false,
  "issuer": {
    "model": "GPT-5.6 Sol",
    "reasoning_level": "high"
  }
}
