{
  "schema": "PREDICTION_RESULT_RECEIPT_V1",
  "receipt_id": "RESULT-RECEIPT-1791228368-3fa258f74ccd",
  "event_id": "1791228368-3fa258f74ccd",
  "source_task_id": "DEV-PRED-PRODUCTION-SNAPSHOT-CANDIDATE-STATUS-20261005-E046",
  "created_at_utc": "2026-10-05T19:34:00Z",
  "live_trading": false,
  "paid_actions": false,
  "wallet_actions": false,
  "issuer": {
    "model": "GPT-5.6 Sol",
    "reasoning_level": "High"
  }
}
