{
  "schema": "PREDICTION_RESULT_RECEIPT_V1",
  "receipt_id": "RESULT-RECEIPT-1791439289-db92e3e317d4",
  "event_id": "1791439289-db92e3e317d4",
  "source_task_id": "DEV-PRED-A2Z-R4P2-READ-REVIEW-FLAT-20261008-N1E123",
  "created_at_utc": "2026-10-08T06:08:00Z",
  "live_trading": false,
  "paid_actions": false,
  "wallet_actions": false,
  "issuer": {
    "model": "GPT-5.6 Sol",
    "reasoning_level": "High"
  }
}
