{
  "schema": "PREDICTION_RESULT_RECEIPT_V1",
  "receipt_id": "RESULT-RECEIPT-1791220742-80fa7f10d9b4",
  "event_id": "1791220742-80fa7f10d9b4",
  "source_task_id": "DEV-FG-CONTROL-CENTER-CSS-FIX-20261005-E066",
  "created_at_utc": "2026-10-05T17:20:00Z",
  "live_trading": false,
  "paid_actions": false,
  "wallet_actions": false,
  "issuer": {
    "model": "GPT-5.6 Sol",
    "reasoning_level": "UNAVAILABLE_TO_RUNTIME"
  }
}
