{
  "schema": "PREDICTION_RESULT_RECEIPT_V1",
  "receipt_id": "RESULT-RECEIPT-cont-1791405778005-b3f0c8eb",
  "event_id": "cont-1791405778005-b3f0c8eb",
  "source_task_id": "CONT-WAKE-a2e56b27f8477412d824d04e-A01",
  "created_at_utc": "2026-10-07T20:58:30Z",
  "live_trading": false,
  "paid_actions": false,
  "wallet_actions": false,
  "issuer": {
    "model": "GPT-5.6 Sol",
    "reasoning_level": "High"
  }
}
