{
  "schema": "PREDICTION_RESULT_RECEIPT_V1",
  "receipt_id": "RESULT-RECEIPT-cont-1791298303178-15ee2222",
  "event_id": "cont-1791298303178-15ee2222",
  "source_task_id": "CONT-WAKE-51fa2d386ca24b79eecd0169-A01",
  "created_at_utc": "2026-10-06T14:58:30Z",
  "live_trading": false,
  "paid_actions": false,
  "wallet_actions": false,
  "issuer": {
    "model": "GPT-5.6 Sol",
    "reasoning_level": "UNAVAILABLE_TO_RUNTIME"
  }
}
