{
  "schema": "PREDICTION_RESULT_RECEIPT_V1",
  "receipt_id": "RESULT-RECEIPT-cont-1791440136065-1e57529d",
  "event_id": "cont-1791440136065-1e57529d",
  "source_task_id": "CONT-WAKE-c55a78b97496c9d85b3b5b45-A01",
  "created_at_utc": "2026-10-08T06:22:30Z",
  "live_trading": false,
  "paid_actions": false,
  "wallet_actions": false,
  "issuer": {
    "model": "GPT-5.6 Sol",
    "reasoning_level": "High"
  }
}
