{
  "schema": "PREDICTION_RESULT_RECEIPT_V1",
  "receipt_id": "RESULT-RECEIPT-cont-1791455960831-44e9e561",
  "event_id": "cont-1791455960831-44e9e561",
  "source_task_id": "CONT-WAKE-d7a1e07334689725ce41f273-A03",
  "created_at_utc": "2026-10-08T11:10:00Z",
  "live_trading": false,
  "paid_actions": false,
  "wallet_actions": false,
  "issuer": {
    "model": "GPT-5.6 Sol",
    "reasoning_level": "High"
  }
}
