{
  "schema": "PREDICTION_RESULT_RECEIPT_V1",
  "receipt_id": "RESULT-RECEIPT-1791485081-adbc6e1a5586",
  "event_id": "1791485081-adbc6e1a5586",
  "source_task_id": "DEV-PRED-INDEPENDENT-CONTINUITY-SERVICE-ROOT-20261008-E011",
  "created_at_utc": "2026-10-08T18:46:50.895Z",
  "live_trading": false,
  "paid_actions": false,
  "wallet_actions": false,
  "issuer": {
    "model": "GPT-6",
    "reasoning_level": "UNAVAILABLE_TO_RUNTIME"
  }
}
