{
  "schema": "PREDICTION_RESULT_RECEIPT_V1",
  "receipt_id": "RESULT-RECEIPT-cont-1791295387933-9f88654c",
  "event_id": "cont-1791295387933-9f88654c",
  "source_task_id": "CONT-WAKE-e7d98884476ddc35a0800bbd-A01",
  "created_at_utc": "2026-10-06T14:09:00Z",
  "live_trading": false,
  "paid_actions": false,
  "wallet_actions": false,
  "issuer": {
    "model": "GPT-5.6 Sol",
    "reasoning_level": "UNAVAILABLE_TO_RUNTIME"
  }
}
