{
  "schema": "PREDICTION_RESULT_RECEIPT_V1",
  "receipt_id": "RESULT-RECEIPT-cont-1791152749053-541a8421",
  "event_id": "cont-1791152749053-541a8421",
  "source_task_id": "CONT-WAKE-1eba06dd31fbecbcbb34a7c3-A01",
  "created_at_utc": "2026-10-04T22:34:30Z",
  "live_trading": false,
  "paid_actions": false,
  "wallet_actions": false,
  "issuer": {
    "model": "GPT-5.6 Sol",
    "reasoning_level": "UNAVAILABLE_TO_RUNTIME"
  }
}
