{
  "schema": "PREDICTION_RESULT_RECEIPT_V1",
  "receipt_id": "RESULT-RECEIPT-1791152744-4b7a7290f77b",
  "event_id": "1791152744-4b7a7290f77b",
  "source_task_id": "DEV-PRED-ASTRA-ACTIVE-ROUTE-DISCOVERY-DIRECT-20261005",
  "created_at_utc": "2026-10-04T22:31:00Z",
  "live_trading": false,
  "paid_actions": false,
  "wallet_actions": false,
  "issuer": {
    "model": "GPT-5.6 Sol",
    "reasoning_level": "UNAVAILABLE_TO_RUNTIME"
  }
}
