{
  "schema": "PREDICTION_RESULT_RECEIPT_V1",
  "receipt_id": "RESULT-RECEIPT-cont-1791452633948-e6f23725",
  "event_id": "cont-1791452633948-e6f23725",
  "source_task_id": "CONT-WAKE-7a86796d84842536d3dcd0cf-A01",
  "created_at_utc": "2026-10-08T10:07:00Z",
  "live_trading": false,
  "paid_actions": false,
  "wallet_actions": false,
  "issuer": {
    "model": "GPT-5.6 Sol",
    "reasoning_level": "High"
  }
}
