{
  "schema": "PREDICTION_RESULT_RECEIPT_V1",
  "receipt_id": "RESULT-RECEIPT-1791054576-ad0097d02952",
  "event_id": "1791054576-ad0097d02952",
  "source_task_id": "DEV-PRED-CONT-NEXT-580ab8ca63181c7210843228",
  "created_at_utc": "2026-10-03T20:05:30Z",
  "live_trading": false,
  "paid_actions": false,
  "wallet_actions": false,
  "issuer": {
    "model": "GPT-5.6 Sol",
    "reasoning_level": "UNAVAILABLE_TO_RUNTIME"
  }
}
