{
  "schema": "PREDICTION_RESULT_RECEIPT_V1",
  "receipt_id": "RESULT-RECEIPT-cont-1791456022683-4e41fd2f",
  "event_id": "cont-1791456022683-4e41fd2f",
  "source_task_id": "CONT-WAKE-dbf6a75aa9cba449b43667fc-A01",
  "created_at_utc": "2026-10-08T11:19:30Z",
  "live_trading": false,
  "paid_actions": false,
  "wallet_actions": false,
  "issuer": {
    "model": "GPT-5.6 Sol",
    "reasoning_level": "High"
  }
}
