{
  "schema": "PREDICTION_RESULT_RECEIPT_V1",
  "receipt_id": "RESULT-RECEIPT-cont-1791188473205-c1f05e6f",
  "event_id": "cont-1791188473205-c1f05e6f",
  "source_task_id": "CONT-WAKE-9f5fc295754c1213732317e6-A01",
  "created_at_utc": "2026-10-05T08:28:00Z",
  "live_trading": false,
  "paid_actions": false,
  "wallet_actions": false,
  "issuer": {
    "model": "GPT-5.6 Sol",
    "reasoning_level": "UNAVAILABLE_TO_RUNTIME"
  }
}
