{
  "schema": "PREDICTION_RESULT_RECEIPT_V1",
  "receipt_id": "RESULT-RECEIPT-cont-1791287637037-4a2a02d5",
  "event_id": "cont-1791287637037-4a2a02d5",
  "source_task_id": "CONT-WAKE-8e4386a72f380aab93047574-A02",
  "created_at_utc": "2026-10-06T11:53:57.037Z",
  "live_trading": false,
  "paid_actions": false,
  "wallet_actions": false,
  "issuer": {
    "model": "GPT-5.6 Sol",
    "reasoning_level": "UNAVAILABLE_TO_RUNTIME"
  }
}
